{
  "$schema": "https://taskurotta.dev/radish/schema/ast-1.json",
  "schema_version": 1,
  "source_id": "workflow.rad",
  "span": {
    "start": {"offset": 0, "line": 1, "column": 1},
    "end": {"offset": 182, "line": 15, "column": 1}
  },
  "version_directive": {
    "kind": "version_directive",
    "keyword_source": "Radish",
    "value_source": "1",
    "value": 1,
    "span": {
      "start": {"offset": 0, "line": 1, "column": 1},
      "end": {"offset": 10, "line": 2, "column": 1}
    }
  },
  "workflow": {
    "kind": "workflow_declaration",
    "keyword_source": "Workflow",
    "entries": [
      {
        "kind": "field",
        "name": {
          "kind": "identifier",
          "source": "name",
          "canonical": "name",
          "span": {
            "start": {"offset": 23, "line": 4, "column": 3},
            "end": {"offset": 27, "line": 4, "column": 7}
          }
        },
        "value": {
          "kind": "string",
          "style": "bare",
          "source": "Build",
          "value": "Build",
          "span": {
            "start": {"offset": 29, "line": 4, "column": 9},
            "end": {"offset": 34, "line": 4, "column": 14}
          }
        },
        "span": {
          "start": {"offset": 23, "line": 4, "column": 3},
          "end": {"offset": 35, "line": 5, "column": 1}
        }
      },
      {
        "kind": "field",
        "name": {
          "kind": "identifier",
          "source": "timeout",
          "canonical": "timeout",
          "span": {
            "start": {"offset": 37, "line": 5, "column": 3},
            "end": {"offset": 44, "line": 5, "column": 10}
          }
        },
        "value": {
          "kind": "duration",
          "source": "2h",
          "amount": 2,
          "unit_source": "h",
          "canonical_unit": "h",
          "span": {
            "start": {"offset": 46, "line": 5, "column": 12},
            "end": {"offset": 48, "line": 5, "column": 14}
          }
        },
        "span": {
          "start": {"offset": 37, "line": 5, "column": 3},
          "end": {"offset": 49, "line": 6, "column": 1}
        }
      },
      {
        "kind": "field",
        "name": {
          "kind": "identifier",
          "source": "max-runs",
          "canonical": "max-runs",
          "span": {
            "start": {"offset": 51, "line": 6, "column": 3},
            "end": {"offset": 59, "line": 6, "column": 11}
          }
        },
        "value": {
          "kind": "integer",
          "source": "50",
          "value": 50,
          "span": {
            "start": {"offset": 61, "line": 6, "column": 13},
            "end": {"offset": 63, "line": 6, "column": 15}
          }
        },
        "span": {
          "start": {"offset": 51, "line": 6, "column": 3},
          "end": {"offset": 64, "line": 7, "column": 1}
        }
      }
    ],
    "span": {
      "start": {"offset": 11, "line": 3, "column": 1},
      "end": {"offset": 64, "line": 7, "column": 1}
    }
  },
  "nodes": [
    {
      "kind": "node_declaration",
      "keyword_source": "Node",
      "name": {
        "kind": "identifier",
        "source": "test",
        "canonical": "test",
        "span": {
          "start": {"offset": 70, "line": 8, "column": 6},
          "end": {"offset": 74, "line": 8, "column": 10}
        }
      },
      "entries": [
        {
          "kind": "field",
          "name": {
            "kind": "identifier",
            "source": "type",
            "canonical": "type",
            "span": {
              "start": {"offset": 78, "line": 9, "column": 3},
              "end": {"offset": 82, "line": 9, "column": 7}
            }
          },
          "value": {
            "kind": "identifier_value",
            "source": "bash-command",
            "canonical": "bash-command",
            "span": {
              "start": {"offset": 84, "line": 9, "column": 9},
              "end": {"offset": 96, "line": 9, "column": 21}
            }
          },
          "span": {
            "start": {"offset": 78, "line": 9, "column": 3},
            "end": {"offset": 97, "line": 10, "column": 1}
          }
        },
        {
          "kind": "field",
          "name": {
            "kind": "identifier",
            "source": "command",
            "canonical": "command",
            "span": {
              "start": {"offset": 99, "line": 10, "column": 3},
              "end": {"offset": 106, "line": 10, "column": 10}
            }
          },
          "value": {
            "kind": "string",
            "style": "bare",
            "source": "echo build",
            "value": "echo build",
            "span": {
              "start": {"offset": 108, "line": 10, "column": 12},
              "end": {"offset": 118, "line": 10, "column": 22}
            }
          },
          "span": {
            "start": {"offset": 99, "line": 10, "column": 3},
            "end": {"offset": 119, "line": 11, "column": 1}
          }
        },
        {
          "kind": "field",
          "name": {
            "kind": "identifier",
            "source": "env",
            "canonical": "env",
            "span": {
              "start": {"offset": 121, "line": 11, "column": 3},
              "end": {"offset": 124, "line": 11, "column": 6}
            }
          },
          "value": {
            "kind": "map",
            "entries": [
              {
                "kind": "map_entry",
                "key": {
                  "kind": "string",
                  "style": "quoted",
                  "source": "\"BUILD_MODE\"",
                  "value": "BUILD_MODE",
                  "span": {
                    "start": {"offset": 130, "line": 12, "column": 5},
                    "end": {"offset": 142, "line": 12, "column": 17}
                  }
                },
                "value": {
                  "kind": "string",
                  "style": "bare",
                  "source": "local",
                  "value": "local",
                  "span": {
                    "start": {"offset": 144, "line": 12, "column": 19},
                    "end": {"offset": 149, "line": 12, "column": 24}
                  }
                },
                "span": {
                  "start": {"offset": 130, "line": 12, "column": 5},
                  "end": {"offset": 150, "line": 13, "column": 1}
                }
              }
            ],
            "span": {
              "start": {"offset": 130, "line": 12, "column": 5},
              "end": {"offset": 150, "line": 13, "column": 1}
            }
          },
          "span": {
            "start": {"offset": 121, "line": 11, "column": 3},
            "end": {"offset": 150, "line": 13, "column": 1}
          }
        },
        {
          "kind": "bindings",
          "keyword_source": "with",
          "bindings": [
            {
              "kind": "binding",
              "form": "compact",
              "name": {
                "kind": "identifier",
                "source": "build-mode",
                "canonical": "build-mode",
                "span": {
                  "start": {"offset": 162, "line": 14, "column": 5},
                  "end": {"offset": 172, "line": 14, "column": 15}
                }
              },
              "value": {
                "kind": "string",
                "style": "bare",
                "source": "release",
                "value": "release",
                "span": {
                  "start": {"offset": 174, "line": 14, "column": 17},
                  "end": {"offset": 181, "line": 14, "column": 24}
                }
              },
              "span": {
                "start": {"offset": 162, "line": 14, "column": 5},
                "end": {"offset": 182, "line": 15, "column": 1}
              }
            }
          ],
          "span": {
            "start": {"offset": 152, "line": 13, "column": 3},
            "end": {"offset": 182, "line": 15, "column": 1}
          }
        }
      ],
      "span": {
        "start": {"offset": 65, "line": 8, "column": 1},
        "end": {"offset": 182, "line": 15, "column": 1}
      }
    }
  ]
}
